Polymer_Name,Tensile_strength(Mpa),Ionization_Energy(eV),Electron_Affinity(eV),LogP,Refractive_Index,Molecular_Weight(g/mol),SMILES_Notation,Uses
Polyetherketoneketone (PEKK),95,10.1,0.55,2.7,1.66,250.28,C1=CC=C(C=C1)C(=O)CC(=O)O,"High-performance, aerospace-grade printing"
Polyether Ether Ketone (PEEK - 3D Printing Grade),100,10.2,0.5,2.5,1.67,238.3,O=C1C=CC(=O)C=C1,"Medical implants, automotive, aerospace"
Liquid Crystal Polymer (LCP),90,9.8,0.45,2.9,1.68,200.25,C1=CC=C(C=C1)C=C(C=C)C=C,"Ultra-strong, high-precision parts"
Poly(methyl methacrylate) (PMMA - 3D Printing Grade),80,9.1,0.25,1.4,1.49,100.12,C(CO)=OCC,"Transparent parts, light diffusers"
Epoxy-Based Photopolymer Resins,60,9.3,0.4,1.8,1.55,250.26,C1=CC=CC(OCC)=C1,"SLA & DLP printing, smooth detailed prints"
Silicone-Based 3D Printing Polymers,10,8.5,0.15,0.5,1.42,162.14,C1=COC(=O)C=C1O,"Soft, flexible medical devices"
Polyamide-imide (PAI - Torlon),120,10.5,0.5,2.6,1.7,270.33,O=C1NC(=O)C2=C(C1=O)C=CC=C2,Ultra-high-strength industrial applications
Acrylate-Based UV Resins,55,9,0.35,1.2,1.5,200.18,C=C(C)C(=O)OCC,"SLA & DLP 3D printing, high-detail models"
Teflon (PTFE - 3D Printing Grade),20,10.2,0.4,3,1.35,100.12,C(F)(F)C(F)(F),"Low-friction, chemical-resistant parts"
Polyurethane (PU - Sports Grade),50,9.5,0.35,2.2,1.52,195.23,O=C(NCCO)OC,"Running shoe soles, roller skate wheels"
Polycarbonate (PC - Impact Grade),70,9.7,0.55,2.3,1.58,254.3,C1(C2=CC=CC=C2)C(=O)OC1,"Sports helmets, goggles, visors"
Acrylic (PMMA - Impact Grade),70,9.1,0.25,1.4,1.49,100.12,C(CO)=OCC,"Ice hockey rinks, transparent sports barriers"
"Polyethylene (PE - High-Density, HDPE)",35,8.8,0.1,3.5,1.54,28.05,CCCCC,"Sports bottles, kayak hulls, playground slides"
Polypropylene (PP - Flexible Grade),33,8.9,0.2,3.1,1.49,42.08,CC(C)C,"Yoga mats, protective padding, gym flooring"
"Nylon (PA-6, PA-12 - Sports Fiber)",75,9.4,0.45,2,1.54,180.22,NCCCCCCCCCC(=O)N,"Sportswear, parachutes, climbing ropes"
Aramid Fiber (Kevlar - High-Strength),3000,9.7,0.6,2.7,1.63,238.3,C1=CC=C(C=C1)NC(=O)C=CN,"Bulletproof vests, racing suits, protective gear"
Polystyrene (PS - Lightweight Grade),40,9.1,0.8,2.5,1.59,104.15,CC(C)C1=CC=CC=C1,"Bicycle helmets, surfboard cores"
Polyoxymethylene (POM - Acetal),70,9.6,0.4,2.1,1.48,90.12,OCCOCCO,"Ski bindings, snowboard fasteners"
Fluoropolymer (PTFE - Low Friction),20,10.2,0.4,3,1.35,100.12,C(F)(F)C(F)(F),"Ski coatings, water-resistant sportswear"
Polyvinyl Chloride (PVC - Flexible Sports Grade),55,9.2,0.3,2.5,1.53,62.5,C2H3Cl,"Inflatable boats, soccer balls, yoga mats"
Polybutadiene (PB - High Impact Sports),25,9.4,0.5,3,1.52,54.09,C=CC=CC=CC,"Golf ball cores, tennis shoe soles"
Epoxy Resins (High-Performance Sports Equipment),75,9.3,0.4,1.8,1.55,250.26,C1=CC=CC(OCC)=C1,"Carbon fiber sports gear, tennis rackets"
Polyester (PET - Sports Clothing Fiber),65,9.8,0.5,2.2,1.58,250.32,C1=CC=C(C(OCCO)C=C1)C=O,"Athletic wear, moisture-wicking sports fabrics"
Polyvinylidene Fluoride (PVDF - High-Performance),65,10.5,0.5,3.2,1.42,64.1,C2H2F2,"Fishing lines, sports racket strings"
Thermoplastic Polyimide (TPI - Advanced Sports Gear),105,10,0.6,2.8,1.64,232.22,C1=CC=CS(=O)(=O)CC,"Extreme sports gear, heat-resistant gloves"
Acrylic Resins (PMMA - Paints & Coatings Grade),80,9.1,0.25,1.4,1.49,100.12,C(CO)=OCC,"Clear coatings, automotive finishes"
Alkyd Resins,25,9,0.2,2.5,1.52,675.12,C(C=O)OC(C)C,"Oil-based paints, wood varnishes"
Epoxy Resins (Coatings Grade),75,9.3,0.4,1.8,1.55,250.26,C1=CC=CC(OCC)=C1,"Industrial coatings, corrosion-resistant paints"
Polyurethane (PU - Paints & Coatings),50,9.5,0.35,2.2,1.52,195.23,O=C(NCCO)OC,"Protective coatings, waterproof paints"
Fluoropolymer Coatings (PVDF - Paints & Coatings),65,10.5,0.5,3.2,1.42,64.1,C2H2F2,"Non-stick coatings, weather-resistant finishes"
Epoxy-Polyester Hybrid Coatings,75,9.8,0.55,2,1.54,220.25,C1=CC=C(C(OCCO)C=C1)C=O,"Powder coatings, protective finishes"
Waterborne Acrylics (Emulsion Polymers),35,9.4,0.45,1.2,1.5,110.22,C(OCCO)C=O,"Eco-friendly paints, fast-drying coatings"
Chlorinated Rubber (CR - Paints & Coatings),40,9.2,0.3,2,1.54,120.5,C2H3Cl,"Marine coatings, chemical-resistant paints"
Melamine-Formaldehyde Resins,100,9.6,0.5,2.1,1.65,225.69,C1=NC(NC=N1)C=O,"Durable coatings, scratch-resistant paints"
Polyester-Based Coatings (Saturated Polyester Resins),65,9.8,0.5,2.2,1.58,250.32,C1=CC=C(C(OCCO)C=C1)C=O,"Automotive coatings, powder coatings"
Polyvinyl Butyral (PVB - Coatings & Laminates),30,9.3,0.4,1.5,1.48,98.12,C1CC(OCC)OCC1,"Glass coatings, laminating films"
Urea-Formaldehyde Resins,85,9.5,0.45,1.8,1.6,210.33,C1=NC(NC=N1)C=O,"Industrial coatings, wood finishes"
Cellulose Acetate Butyrate (CAB - Specialty Coatings),40,9.2,0.3,1.5,1.49,300.1,C(OCC)=OCC,"UV-resistant coatings, clear topcoats"
Polyvinylidene Chloride (PVDC - Barrier Coatings),50,9.4,0.35,2.6,1.43,64.5,C2H2Cl2,"Food packaging coatings, corrosion-resistant paints"
Perfluoroalkoxy Polymer (PFA - Fluoropolymer Coatings),70,10.7,0.55,3,1.37,100.2,C(F)(F)C(F)(F),"Anti-fouling coatings, high-performance paints"
Phenolic Resins (Coatings & Varnishes),85,9.9,0.55,2.4,1.66,310.32,C1=CC=C(C=C1)C=O,"High-temperature coatings, corrosion-resistant paints"
Polyamide-Imide (PAI - High-Performance Coatings),105,10,0.6,2.8,1.64,232.22,C1=CC=CS(=O)(=O)CC,"Aerospace coatings, heat-resistant finishes"
Epoxy Resin (Adhesive Grade),75,9.3,0.4,1.8,1.55,250.26,C1=CC=CC(OCC)=C1,"Structural adhesives, aerospace, automotive"
Cyanoacrylate (Super Glue),45,9.8,0.55,0.5,1.46,111.1,CC(=O)OC=C,"Instant adhesives, medical applications"
Polyurethane (PU - Adhesives Grade),60,9.5,0.35,2.2,1.52,195.23,O=C(NCCO)OC,"Construction adhesives, flexible bonding"
Phenolic Resins (Adhesives Grade),70,9.9,0.55,2.4,1.66,310.32,C1=CC=C(C=C1)C=O,"High-temperature adhesives, aerospace"
Acrylic Adhesives (Methacrylate-Based),35,9.2,0.35,1.2,1.49,100.12,C(CO)=OCC,"Structural adhesives, pressure-sensitive adhesives"
Polyamide-Based Adhesives (Hot-Melt Adhesives),40,9.8,0.5,2.6,1.58,250.32,C1=CC=C(C(OCCO)C=C1)C=O,"Automotive adhesives, high-strength bonding"
Epoxy-Polyurethane Hybrid Adhesives,85,9.7,0.52,2,1.54,220.25,C1=CC=C(C(OCCO)C=C1)C=O,"Structural adhesives, impact-resistant bonding"
Chloroprene Rubber (Neoprene Adhesives),30,9.3,0.4,2,1.54,120.5,C2H3Cl,"Contact adhesives, industrial applications"
Polyester-Based Adhesives (Saturated Polyester Resins),45,9.8,0.5,2.2,1.58,250.32,C1=CC=C(C(OCCO)C=C1)C=O,"High-strength adhesives, marine applications"
Polyvinylidene Fluoride (PVDF - Adhesives Grade),55,10.5,0.5,3.2,1.42,64.1,C2H2F2,"Chemical-resistant adhesives, aerospace"
Fluoroelastomers (FKM - High-Performance Adhesives),70,10.7,0.55,3,1.37,100.2,C(F)(F)C(F)(F),"Oil-resistant adhesives, gaskets"
